{
  "version": "1.0",
  "artifact": "SHORTS_PLAN",
  "from_agent": "ju_shorts_planning",
  "topic": "목조주택 공사 순서",
  "hook": "집 짓는 순서를 아세요?",
  "overlay_outline": [
    "집 짓는 순서는?",
    "골조가 먼저",
    "지붕 올리고",
    "외장으로 마무리",
    "제이유 하우징"
  ],
  "overlay_lines": [
    "집 짓는 순서는?",
    "골조가 먼저",
    "지붕 올리고",
    "외장으로 마무리",
    "제이유 하우징"
  ],
  "tone_notes": "공정 단계가 섞인 컷 금지. 각 컷은 한 단계만.",
  "image_prompts": [
    "Only wood framing with 2x6 studs and OSB, no roof finish, Korean site, no text",
    "Roof plywood deck being installed on wood frame house, Korea, no metal yet, no text",
    "Underlayment waterproofing on roof deck, Korean suburban site, no text",
    "Standing seam metal roof panels installation, Korea, no text",
    "Completed exterior with ceramic or fiber-cement siding, standing-seam roof, Korea, no text"
  ],
  "visual_stage_notes": [
    "framing",
    "roof_deck",
    "underlayment",
    "metal_roof",
    "finished_exterior"
  ],
  "brand_check_required": true,
  "created_at": "2026-08-07T12:10:00+09:00"
}
